,filename,transcription,text,wer,cer
3363,7dfbcaed1f72.wav,тда тогда для меня возникает еще и третий способы,тогда для меня возникает ещё и третий способ,0.375,0.1363636363636363
3364,7e047c37bb55.wav,и во все в это влезатель все во все это участвовать,во всё это влезать во всём этом участвовать,0.875,0.3255813953488372
3365,7e050e6f7b57.wav,и гораздо больше чем  канваиров,их гораздо больше чем конвоиров,0.4,0.1290322580645161
3366,7e066a0faef8.wav,подум с я уже представил как он заканчил,потому что я уже представил как он заканчивается,0.375,0.25
3367,7e07de74420e.wav,потому что случается что нельзя вылечить но можно помоть,потому что случается что нельзя вылечить но можно помочь,0.1111111111111111,0.0178571428571428
3368,7e0cbd5703f3.wav,и тогда начал думать на тформой,и тогда я начал думать над формой,0.4285714285714285,0.1212121212121212
3369,7e10898ee6ef.wav,и стране под названием словетский союз и я родилсо советской армении выраз закончил,стране под названием советский союз,1.8,1.3714285714285714
3370,7e1176a125d4.wav,уровень развития дектитов и людей намного пережает пручей виде жизни,нг уровень развития дельфинов и людей намного опережает прочие виды жизни,0.4545454545454545,0.1643835616438356
3371,7e13f9b130a0.wav,согда можно уже сейчас подумать о чем вы хотите думать перед смертью,то тогда можно уже сейчас подумать о чём вы хотите думать перед смертью,0.2307692307692307,0.0704225352112676
3372,7e1db0fcd0a5.wav,сняется теплоемкостью воды которые они в основном являются сами,что объясняется теплоёмкостью воды которой они в основном являются сами,0.4,0.1549295774647887
3373,7e1de8c65ee7.wav,это был полный свод правил выявление дьявола и разоблачению,это был полный свод правил выявления дьявола и разоблачения его,0.3,0.0952380952380952
3374,7e20d3b6010d.wav,ты мне очень дорог,ты мне очень дорог,0.0,0.0
3375,7e28f9758ea9.wav,на самом деле конечно не история науке но тем тег,это на самом деле конечно не история науки но тем не менее,0.3333333333333333,0.2068965517241379
3376,7e31ae5bd8ff.wav,есть лисы священнике здесь есть на алтаре,здесь есть лисы священники здесь есть алтарь,0.5714285714285714,0.25
3377,7e3e2ee8436d.wav,что я буду его слышать что я буду с ним разговаривать,что я буду его слышать что я буду с ним разговаривать,0.0,0.0
3378,7e470e58b2d7.wav,есть ряд втерио типов,есть ряд стереотипов о том,0.6,0.3461538461538461
3379,7e4b66938520.wav,тому что может быть боимся каких-то по результатов что нас чет неполучькь,потому что боимся каких то результатов что у нас что то не получится,0.7692307692307693,0.4117647058823529
3380,7e4c2d3452bb.wav,потом хозяйсная часяь,потом хозяйственная часть,0.6666666666666666,0.2
3381,7e59a63a21cd.wav,отменя представи ли котчей на европейской акодеме откуда вознает,вот меня представили как члена европейской академии,1.1428571428571428,0.5098039215686274
3382,7e5d38f4388d.wav,вы идете и думаете об отношениях с родителями,вы идёте и думаете об отношениях с родителями,0.125,0.0222222222222222
3383,7e6df3849c81.wav,и-то дает ощущения прикосновение к чему-то важныму,это даёт ощущение прикосновения к чему то важному,0.875,0.1428571428571428
3384,7e8406518067.wav,перь подниметь руку задумать что хороше последнее третье слово,теперь поднимите руку кто думает что хорошее последнее третье слово,0.5,0.1641791044776119
3385,7eb40d225fcf.wav,который в своей жизни пережил эпизот свободного валения,который в своей жизни пережил эпизод свободного воления,0.25,0.0363636363636363
3386,7ec137e29bc9.wav,мы это проверим сейчас с вами как это работает,мы это проверим сейчас с вами как это работает,0.0,0.0
3387,7ec9fe602397.wav,ыется харткор и даже сделал неплохою казу,он называется хардкор и даже сделал неплохую кассу,0.625,0.24
3388,7ed0f648ca59.wav,напискать  подет что-нибудь такое,то попадётся что нибудь такое,0.8,0.5172413793103449
3389,7ed39eeaa871.wav,и люди в нашем партнерене наши женени в нашем муже и так далее,или не в нашем партнёре не в нашей жене не в нашем муже и так далее,0.5,0.1940298507462686
3390,7eefa323a79e.wav,то тогда он пользет смесью рационального и инитуитивного,то тогда он пользуется смесью рационального и интуитивного,0.25,0.0689655172413793
3391,7ef60ebec186.wav,технологии нам помогут мы на сам деле все будем меньше меньше работ,технологии нам помогут мы будем всё меньше и меньше работать,0.7,0.35
3392,7ef9169ca3ba.wav,где люди начинают выслушивать друг друга или диначинают понимать друг друга,где начинают выслушивать друг друга и люди начинают понимать друг друга,0.3636363636363636,0.1267605633802817
3393,7efd1de570e3.wav,ты изнутри себя начинай с выползать нарузу,ты изнутри себя начинаешь выползать наружу,0.5,0.0952380952380952
3394,7f34742701eb.wav,в течене последнего миллиона лет,и здесь в течение последнего миллиона лет,0.4285714285714285,0.2195121951219512
3395,7f35baf35e1b.wav,культура жизнь набстоятельства мы име не решаем,культура жизненные обстоятельства,2.0,0.696969696969697
3396,7f3c190f6fe6.wav,бабовы арихи злаки и грибы содержит достаточное количество минакислы,бобовые орехи злаки и грибы содержат достаточное количество аминокислот,0.4444444444444444,0.1267605633802817
3397,7f41beb81955.wav,мы их держам их не отпуская,мы их держим мы их не отпускаем,0.4285714285714285,0.1935483870967742
3398,7f45cf640f7e.wav,он же всреми думал как добиться как узнать три карта,он же всё время думал как узнать три карты,0.5555555555555556,0.4285714285714285
3399,7f4f159d74b0.wav,ктих стонах обязаетельно должно быть некая недосказанность,в этих тонах обязательно должна быть некая недосказанность,0.625,0.1034482758620689
3400,7f4f7a6cb583.wav,от каких заболеваний защищает его микробе,от каких заболеваний защищают его микробы,0.3333333333333333,0.048780487804878
3401,7f516f0ff49b.wav,социальны мы всегда чувствуем и перенимаем настроение к друг друга,люди социальны мы всегда чувствуем и перенимаем настроение друг друга,0.2,0.1014492753623188
3402,7f5d9ad6a09b.wav,люди не именно этой категории максимально отрезваны от мира,люди именно этой категории максимально отрезаны от мира,0.25,0.0727272727272727
3403,7f5f9bbbd43d.wav,они закидали нас вопросами и предложениям,они закидали нас вопросами и предложениями,0.1666666666666666,0.0238095238095238
3404,7f625458cde8.wav,и взависимости оттого что происходит с молоком,и в зависимости от того что происходит с молоком,0.4444444444444444,0.0416666666666666
3405,7f7561f55a13.wav,это ваша жизнь это то что вы имеете сегодня,это ваша жизнь это то что вы имеете сегодня,0.0,0.0
3406,7f76909579e8.wav,чтобы смотреть это самое интересное хорошее кено,чтобы смотреть это самое интересное хорошее кино,0.1428571428571428,0.0208333333333333
3407,7f80a441953b.wav,мгчово смеетесь вы пристан,ну что вы смеётесь,0.75,1.0
3408,7f86b61433b9.wav,это цене могут присутствовать всего несколько мысле октеров,на этой сцене могут присутствовать всего несколько мыслей актёров,0.5555555555555556,0.123076923076923
3409,7f8a4cbc27ea.wav,у тасу многих наверно именно в хлодильнике стоит в лакардин,у нас у многих наверное именно в холодильнике стоит валокордин,0.6,0.1129032258064516
3410,7f8f114e10f1.wav,багодаря действию большого пальца на моей правой руке,благодаря действию большого пальца на моей правой руке,0.125,0.0185185185185185
3411,7fb19bb06d8e.wav,не видели даже не слышили про эти именайти намзвучательные картины,мы их не видели даже не слышали эти имена эти замечательные картины,0.5833333333333334,0.2537313432835821
3412,7fb6b2ce500a.wav,мы видим что это медико-биологическая проблема,мы видим что это медико биологическая проблема,0.2857142857142857,0.0217391304347826
3413,7fb8795ec8f4.wav,долную меня нет больше сило терпеть в этот коктопытв,у меня нет больше сил терпеть это как пытка,0.5555555555555556,0.3255813953488372
3414,7fde395cabe4.wav,сильный тот кто научился управлять своими привычками менять свои привычшек,сильный тот кто научился управлять своими привычками менять свои привычки,0.1,0.0410958904109589
3415,7fe394c805cf.wav,таким убразами хотел бы вам показать что место того чтобы искать,и таким образом я хотел бы вам показать что вместо того чтобы искать,0.3076923076923077,0.1029411764705882
3416,7fff09210e43.wav,всегда движения по бездорожью и ощипки неизбежны,поиск это всегда движение по бездорожью и ошибки неизбежны,0.4444444444444444,0.2241379310344827
3417,8014cf08e9c3.wav,которые все средства и развительности завязаны ворганичный осел,в которой все средства выразительности завязаны в органичный узел,0.7777777777777778,0.1538461538461538
3418,80218c390347.wav,быть честным с собой со своими близкими честно сказать чего тебе хочется,быть честным с собой со своими близкими честно сказать чего тебе хочется,0.0,0.0
3419,802582b31f68.wav,третий подпрогивать идут,третий подпрыгивать идёшь,0.6666666666666666,0.16
3420,802afb26766c.wav,и спрошу их отдельно от этой ситуации,и спрошу их отдельно от этой ситуации,0.0,0.0
3421,802ebad659c9.wav,мы нажинаем с ней работать и много много разговариваем я,мы начинаем с ней работать и много много разговариваем,0.2222222222222222,0.0555555555555555
3422,803459ff2ba9.wav,в результате из трех слов одно было обработать проще,в результате из трёх слов одно было обработать проще,0.1111111111111111,0.0192307692307692
3423,80381d818ded.wav,пропало похватились история была громкая,пропала спохватились история была громкая,0.4,0.048780487804878
3424,8050726f4845.wav,иродить в теле то чусто которое вдохновило художника,и родить в теле то чувство которое вдохновило художника,0.3333333333333333,0.0545454545454545
3425,8051f67c5536.wav,сегодня много говорилось о рациональности обосозноности,сегодня много говорилось о рациональности об осознанности,0.2857142857142857,0.0526315789473684
3426,8058b57f27ea.wav,да можно поздно нажется спать,да можно поздно ложиться спать,0.2,0.1333333333333333
3427,805d234bfd95.wav,нам кажется что каждая наша мысль к,нам кажется что каждая наша мысль,0.1666666666666666,0.0606060606060606
3428,8063e6ef3494.wav,еще еще есть наутод,ещё есть там кто то,1.0,0.631578947368421
3429,8067d37060df.wav,тропево того что ситуация целекон находится на вашей стороне,оторопев от того что ситуация целиком находится на вашей стороне,0.3,0.09375
3430,80754dd13279.wav,ли мы польмем такую казалось бы крохотную деталь,и если мы поймём такую казалось бы крохотную деталь,0.3333333333333333,0.1372549019607843
3431,8091e9bd8f3f.wav,ну старини нас постерегает,но старение нас подстерегает,0.75,0.1428571428571428
3432,8099d3986b3b.wav,нас учили не доверять себе ни в чем и сомневаться в каждом своим успехи,нас учили не доверять себе ни в чём и сомневаться в каждом своём успехе,0.2142857142857142,0.0422535211267605
3433,80a2726cf58b.wav,и положил руку мне воцюда на слту,и положил руку мне вот сюда на блузку,0.375,0.1891891891891892
3434,80a4ceef96e4.wav,это юзе которые хотят могут и покупают больше,это люди которые хотят могут и покупают больше,0.125,0.0652173913043478
3435,80ae8dd3a657.wav,пвется гломурьного мира от которого скорее всего ничег не останется и так далее,певец гламурного мира от которого скорее всего ничего не останется и т д,0.3846153846153846,0.1805555555555555
3436,80b2553af0c5.wav,выбрать и ножать кнотку на одном из пультоф левом элепра,выбрать и нажать кнопку на одном из пультов левом или правом,0.4545454545454545,0.15
3437,80b51522e438.wav,и дело совсем не в том что разжатым кулаком трудно удари,и дело совсем не в том что разжатым кулаком трудно ударить,0.0909090909090909,0.0344827586206896
3438,80bcdd84c2d2.wav,поэтому все поиски на творческом пути связаны с большими опасностями,поэтому все поиски на творческом пути связаны с большими опасностями,0.0,0.0
3439,80bed34590b3.wav,но тысячной отобщего здоровья я водято скоро,на одну тысячную от общего здоровья,1.1666666666666667,0.6571428571428571
3440,80cd52df2b94.wav,бы планирующего с мороженым ад вперёда льбезмороженого,фланирующего с мороженым взад вперёд или без мороженого,0.875,0.2
3441,80d28836516f.wav,в то же время мне прописали большой пакет волшебных беллюй,в то же время мне прописали большой пакет волшебных пилюль,0.1,0.0862068965517241
3442,80d2f248fd59.wav,оказывается самые велики учителять наши дети,оказывается самые великие учителя это наши дети,0.4285714285714285,0.0851063829787234
3443,80d9325d4bc8.wav,он был такой теплый и конфортный что чуть было не дал себе обещания,он был такой тёплый и комфортный что я чуть было не дал себе обещание,0.2857142857142857,0.072463768115942
3444,80dfc1a70b8f.wav,да за счастьем суда засчастимый но никак у них не получается,все туда за счастьем сюда за счастьем ну никак у них не получается,0.4615384615384615,0.1969696969696969
3445,80e87439d2d3.wav,это когда бизнес перерастает своего владельцы,это когда бизнес перерастает своего владельца,0.1666666666666666,0.0222222222222222
3446,80f98defc20e.wav,я увидела что конфликт нашим обществем чразобщением,я увидела что конфликт в нашем обществе вообще разобщение,0.5555555555555556,0.2105263157894736
3447,8111fd4eec4e.wav,сейчас я ом покажу двух девчонок это я детям показываена,сейчас я покажу вам двух девчонок это я детям показываю,0.3,0.1818181818181818
3448,81266f1ca98e.wav,в южденевнебыт,в её ежедневный быт,0.75,0.4736842105263157
3449,812b3f946fb5.wav,асуется за каждою за каждое из решенич казень сылка не виновь,когда голосуется за каждое из решений казнь ссылка не виновен,0.7,0.360655737704918
3450,81305d40facf.wav,идем и знать у нас прекрасные сдати добавим немного весны,идём и знаете у нас прекрасное давайте добавим немного весны,0.4,0.15
3451,814fe9a01e0e.wav,некоторые наируученые и когнетивные психологи делают вывод,некоторые нейроучёные и когнитивные психологи делают вывод,0.2857142857142857,0.0862068965517241
3452,8178f45e9795.wav,люди цени неры экономистов они востребовано не нужны,люди ценят нейроэкономистов они востребованы они нужны,0.7142857142857143,0.1481481481481481
3453,817a254bbd7a.wav,является следствием концептуальных ошибок,является следствием концептуальных ошибок,0.0,0.0
3454,8180b3b51694.wav,спасибо больше,спасибо большое,0.5,0.0666666666666666
3455,81855259ca59.wav,это очень важный момент,это очень важный момент,0.0,0.0
3456,81907b00cc8e.wav,сейчас редко в каких семьях про это говорят но иногда говоря,сейчас редко в каких семьях про это говорят но иногда говорят,0.0909090909090909,0.0163934426229508
3457,819bcbaa728c.wav,и начинает и строить его сознанно,и начинайте строить его осознанно,0.6,0.1212121212121212
3458,81aea9c2a5ca.wav,ты сейчас должен сказать первую цифру один но с сознанием того,ты сейчас должен сказать первую цифру один но с сознанием того,0.0,0.0
3459,81b059c7e8be.wav,и что же случилось он увидел телевизор,и что же случилось он увидел телевизор,0.0,0.0
3460,81b15cad7731.wav,и я даже искренне завидую тем из вас,и я даже искренне завидую тем из вас,0.0,0.0
3461,81ba5cedc12e.wav,который позволяет опять-таки выйти архитектору историрам,который позволяет опять таки выйти архитектору из той рамки,0.5555555555555556,0.1186440677966101
3462,81d6a2a441c1.wav,образовать команду,образовать команду,0.0,0.0
3463,81e8b3f3dec5.wav,потому что для каждого из них этот контакт трансформативен,потому что для каждого из них этот контакт трансформативен,0.0,0.0
3464,81ee999af75b.wav,который считал что ребенка нужно водить помузеям,который считал что ребёнка нужно водить по музеям,0.375,0.0408163265306122
3465,81f85c73d9d6.wav,кчем их нужна поддержка,зачем им нужна поддержка,0.5,0.125
3466,82035689115a.wav,или клирик что важнее цензер,или что важнее клирик цензор,0.6,0.5357142857142857
3467,821edc8cf28f.wav,вотвичая от присутствие на планете дельфинов очевидно уже изкулсмоса,в отличие от присутствия на планете дельфинов очевидно уже из космоса,0.4545454545454545,0.1159420289855072
3468,822a656a772e.wav,и вот он выров,и вот он вырос,0.25,0.0714285714285714
3469,822e442b81ff.wav,если мы расходуем у сейчас ту завтра нам уже не хватит,и если мы расходуем их сейчас то завтра нам уже не хватит,0.25,0.087719298245614
3470,824326b6c24a.wav,зье конторы куда принимают пу,что это две конторы куда принимают по уму,0.625,0.3414634146341463
3471,825c5f0ec2b0.wav,я знече недел для это ниче не хотел дли этогоно,я же ничего не делал для этого ничего не хотел для этого,0.6666666666666666,0.2857142857142857
3472,82609f728bd9.wav,к новорожданному ребенку который не ведает что творит,к новорождённому ребёнку который не ведает что творит,0.25,0.0377358490566037
3473,82699d9fcb51.wav,повере вашей и делам вашим воздастся,по вере вашей и делам вашим воздастся,0.2857142857142857,0.027027027027027
3474,826a2103cfe2.wav,у которые свои планы которые играть свои игры,у которого есть свои планы который играет в свои игры,0.5,0.2075471698113207
