,filename,transcription,text,wer,cer
0,00215732fe04.wav,они вовлечены гораздо больше,они вовлечены гораздо больше,0.0,0.0
1,002f252e502b.wav,но вряд ли кто обменяет этот момент прозрение и озарение на то что,но вряд ли кто обменяет этот момент прозрения и озарения на то,0.25,0.0967741935483871
2,0030204ec0f9.wav,это человек который сегодня занимается одним завтра другим,это человек который сегодня занимается одним завтра другим,0.0,0.0
3,0033c013a3cb.wav,пимер в конце зимы начали весны проходит фестеваль извинеции в москву,например в конце зимы начале весны проходит фестиваль из венеции в москву,0.4166666666666667,0.0958904109589041
4,00342b427c24.wav,из всего объема знаний и окружайших вас с событий,из всего объёма знаний и окружающих вас событий,0.375,0.1063829787234042
5,00361fa0a5e9.wav,как м бунюе кататься к океану,как мы будем кататься к океану,0.3333333333333333,0.1333333333333333
6,003b585a4d13.wav,начинает воспалительный процесс,и начинают воспалительный процесс,0.5,0.0909090909090909
7,003c7df04e4b.wav,сейчас мы хотим сделай такое исследование на примере молока,сейчас мы хотим сделать такое исследование на примере молока,0.1111111111111111,0.0333333333333333
8,004232b807df.wav,ого писали да,ого писали да,0.0,0.0
9,00436e646082.wav,и не важно в рубашки вы или в ромматическом платьье,и неважно в рубашке вы или в романтическом платье,0.5555555555555556,0.1020408163265306
10,0043867769f5.wav,довольно быстро  она училась обращать внимание на собственную поесницу,довольно быстро она научилась обращать внимание на собственную поясницу,0.2222222222222222,0.056338028169014
11,004b1de0364d.wav,им образом как философ я утверждаю что данные современные нейра науки,таким образом как философ я утверждаю что данные современной нейронауки,0.4,0.0985915492957746
12,00502577f698.wav,ю мы много деном для буда,и мы многое делаем для будущего,0.6666666666666666,0.3225806451612903
13,0058314126c2.wav,наконец мы пришли к главному,наконец мы пришли к главному,0.0,0.0
14,005bd921f429.wav,строить коллективное решения таким образом,и если строить коллективное решение таким образом,0.4285714285714285,0.1632653061224489
15,005be143ddd5.wav,один простой вопросесть такобо понять доверие доверия,один простой вопрос,1.6666666666666667,1.7894736842105263
16,00601a062ef2.wav,но начать с того что происходит,начать с того что происходит,0.2,0.1071428571428571
17,0080a2841e0d.wav,ка чаще всего сосредоточен именно в сфере как потратить а не как заработать,чаще всего сосредоточен именно в сфере как потратить а не как заработать,0.0833333333333333,0.0416666666666666
18,00843aed472d.wav,он переместился из этого из этой группы западной диеты в группу вегетарианцов,он переместился из группы западной диеты в группу вегетарианцев,0.4444444444444444,0.238095238095238
19,0086ea5d5625.wav,поздна ложится спать,нельзя поздно ложиться спать,0.75,0.3214285714285714
20,0092949145d1.wav,поэтому у меня только одно сообщени,поэтому у меня только одно сообщение,0.1666666666666666,0.0277777777777777
21,00b01adf011a.wav,того чтобы определить в какой именно момент испытуемые принимали решение,для того чтобы определить в какой именно момент испытуемые принимали решение,0.0909090909090909,0.0526315789473684
22,00bb40eda3ab.wav,когда маленькие человече прождается,когда маленький человечек рождается,0.75,0.0857142857142857
23,00be8d6c34a0.wav,и вырабатываетники нурмы которые являются премущественными получают премуеству,и вырабатывает некие нормы которые получают преимущества,0.8571428571428571,0.5892857142857143
24,00c46f08ed28.wav,эта идея метафра на потом выросла в инсталекц,эта идея метафора потом выросла в инсталляцию,0.4285714285714285,0.1777777777777777
25,00d0c4e02ca5.wav,ну бы до допадения,но будут и падения,1.0,0.3888888888888889
26,00d2ef990bba.wav,чьем плоха исторической аналогия тем что она отрицает развитие,чем плоха историческая аналогия тем что она отрицает развитие,0.2222222222222222,0.0491803278688524
27,00de24118c7e.wav,сколько мне еще осталось сколько будет зелано,сколько мне ещё осталось сколько будет сделано,0.2857142857142857,0.0652173913043478
28,00e29734f440.wav,получается что ты с помощь улыбки и доброго слова,получается что ты с помощью улыбки и доброго слова,0.1111111111111111,0.02
29,00e5de76d1ba.wav,я поступил на работу в большой академический институт,я поступил на работу в большой академический институт,0.0,0.0
30,00f01a690e40.wav,тактаки счастливые довольные радуется жизни нечего подобного,такими счастливыми довольными радующимися жизни ничего подобного,0.7142857142857143,0.203125
31,00f0c9097532.wav,кторы его таким забавным образом проявляют,которые таким забавным образом проявляются,0.6,0.1428571428571428
32,00fbc4a52334.wav,ходит с планетарии,ходят в планетарии,0.6666666666666666,0.1111111111111111
33,010ad4ddbf4e.wav,которы не укладываются в принятую картину мира,которые не укладываются в принятую картину мира,0.1428571428571428,0.0212765957446808
34,011079ac806f.wav,сейчас у них там тысяч валлантеров по всей стране,сейчас у них тысячи волонтёров по всей стране,0.375,0.2
35,0113cf5badfe.wav,адо действовать по собственному произволу,надо действовать по собственному произволу,0.2,0.0238095238095238
36,0117fb058e4c.wav,заставляет не зад не задумат с о то,заставляет нас не задумываться о том,0.8333333333333334,0.25
37,013672c1de02.wav,чтанесут кристы несут свече и даже служит мес,несут кресты несут свечи и даже служат мессу,0.625,0.1818181818181818
38,013b879eb7f8.wav,покоеце ни на доказательстве того что у нас ее действительно не,покоится не на доказательстве того что у нас её действительно нет,0.3636363636363636,0.1076923076923077
39,01446bb8c5ba.wav,мы страимся собрать лучаехученных совсемо мира,мы стараемся собрать лучших учёных со всего мира,0.625,0.1875
40,0159d1ae5c4a.wav,первого порядка и желание второго порядка,желания первого порядка и желания второго порядка,0.2857142857142857,0.1836734693877551
41,016581b3285c.wav,помните чему учили в благородном польсионск,а вы помните чему учили в благородном пансионе,0.375,0.217391304347826
42,0171fcf54f31.wav,это просто карта путейнаи меньшего сопротивления в моем мозге,это просто карта путей наименьшего сопротивления в моём мозге,0.3333333333333333,0.0491803278688524
43,0177d438c0e8.wav,три модели их не так много на самом деле мы,три модели,4.0,3.3
44,018ad103b34c.wav,ну вроде с царём соломоном и не поспоришь,ну вроде с царём соломоном и не поспоришь,0.0,0.0
45,0191be1c9fc5.wav,но при этом они насколько плотно инкорпорировали,но при этом они настолько плотно инкорпорировались,0.2857142857142857,0.06
46,0191ed0f9fee.wav,и самой важно это рост влияния человека,и самое важное это рост влияния человека,0.2857142857142857,0.05
47,01a0e36941d4.wav,как активны трансформирующей силы мира,как активной трансформирующей силы мира,0.2,0.0512820512820512
48,01a84344faf4.wav,к друзья и близкем  а в книжный магазин,он пошёл не к друзьям и близким а в книжный магазин,0.4545454545454545,0.2941176470588235
49,01b1ebdc48e6.wav,закончила магистратуру в сфере разрешения конфликтов,я закончила магистратуру в сфере разрешения конфликтов,0.1428571428571428,0.037037037037037
50,01b29741649b.wav,имне доверяю и боспра что же состаронность относитья,им не доверяю и вас прошу с осторожностью относиться,0.7777777777777778,0.3076923076923077
51,01b593daaba1.wav,в которой говорит ся что процедуры все либо диктаторски и либо манипулируемы,в которой говорится что процедуры все либо диктаторские либо манипулируемые,0.5,0.0533333333333333
52,01c169349c58.wav,но возможно сейчас самое время подумать о том что это замечта,но возможно сейчас самое время подумать о том что это за мечта,0.1666666666666666,0.0161290322580645
53,01c5a8746cb1.wav,потом созрить потом замернось еще рас,потом созреть потом замёрзнуть ещё раз,0.6666666666666666,0.1842105263157894
54,01cac6a83f86.wav,отец меня будешь гы этом осман доброе утрое вот ким ты будешь,отец меня будит и говорит осман доброе утро кем ты будешь,0.5454545454545454,0.2807017543859649
55,01cdb0676a5c.wav,этот момент мы бы назвали зарождение жизни,этот момент мы бы назвали зарождение жизни,0.0,0.0
56,01d0343f3280.wav,опель синита как белко оранжевая,об апельсине так как белка оранжевая,0.6666666666666666,0.2222222222222222
57,01e406c45ea9.wav,благодаря нашим работам в частности получили новое развитие,благодаря нашим работам в частности получили новое развитие,0.0,0.0
58,01ef275ae35f.wav,глубинного восприятия образа,глубинного восприятия образа,0.0,0.0
59,01f4461614d7 (1).wav,дышем гододав то самый момент скандала или нетотниз незадолга до него,,,
60,01f4461614d7.wav,дышем гододав то самый момент скандала или нетотниз незадолга до него,дышим да да да в тот самый момент скандала или незадолго до него,0.6153846153846154,0.28125
61,02033da13322.wav,а заключается она в том что люди в нашей стране,а заключается она в том что люди в нашей стране,0.0,0.0
62,02199783d7a3.wav,индустрии моды красоты и развлечений,индустрия моды красоты развлечений,0.5,0.088235294117647
63,022daced3f77.wav,мына самделе нашли идею создания малого бизнеса,мы на самом деле нашли идею создания малого бизнеса,0.4444444444444444,0.0784313725490196
64,022fd4473fca.wav,это делается за счет популяризации,это делается за счёт популяризации,0.2,0.0294117647058823
65,023636d32eaf.wav,где католическое мессу предстает как насквозь лицемирное действо,где католическая месса предстаёт как насквозь лицемерное действо,0.5,0.078125
66,023ac65e4ef8.wav,ивот у нас появелось то чем можно делиться с другими,и вот у нас появилось то чем можно делиться с другими,0.2727272727272727,0.0377358490566037
67,023ce26ed507.wav,ну и там и там тех кто да же подозревался о не согласие с общей  доктрино,но и там и там тех кто даже подозревался в несогласии с общей доктриной,0.5,0.0985915492957746
68,023da16b99c8.wav,и что вместе вы можете больше,и что вместе вы можете больше,0.0,0.0
69,0240f26d7290.wav,достатоки этого правила не известны сантичных времен,недостатки этого правила известны с античных времён,0.7142857142857143,0.1568627450980392
70,024b11ef564e.wav,отстаивали тезиса наличию человека свободой воли,которые отстаивали тезис о наличии у человека свободы воли,0.6666666666666666,0.2586206896551724
71,0250c32f84ff.wav,так вот она привлавт к нам на тринировку,так вот она привела его к нам на тренировку,0.3333333333333333,0.1395348837209302
72,02586905fca4.wav,команд в создание лиздю фо лидерства,в построение команд в создание лидерства,0.6666666666666666,0.55
73,025b8a629505.wav,случается просто касивые картинки т ассамдель ни зачем не нужно но,это просто красивые картинки это на самом деле низачем не нужно,0.7272727272727273,0.3333333333333333
74,026272cee253.wav,не для написания хартий служибных письем записке,не для написания хартий служебных писем записок,0.4285714285714285,0.0851063829787234
75,026ebb74789b.wav,спустя два десятилетия во германии был проведен еще один эксперемен,спустя два десятилетия в германии был проведён ещё один эксперимент,0.4,0.0746268656716417
76,026fea41363c.wav,поэтов сот сетий так называемв молодых львовка,поэтов из соцсетей так называемых молодых львов,0.5714285714285714,0.2127659574468085
77,0273fe9d5470.wav,был первый город с которым мы начали работать больше года назад,это был первый город с которым мы начали работать больше года назад,0.0833333333333333,0.0597014925373134
78,028453fbc524.wav,сейчас источником власти стал и народ,сейчас источником власти стал народ,0.2,0.0571428571428571
79,02932605d43c.wav,что с чему начинается вообщетворчество все начинается радасчасть вые,с чего начинается вообще творчество с чего начинается радость счастье,0.8,0.2898550724637681
80,02a09b78b691.wav,взелетня девочка ушла из дома влес,пятилетняя девочка ушла из дома в лес,0.4285714285714285,0.1621621621621621
81,02a35ba0767e.wav,не надо ний даже рассказывать качке,не надо о ней даже рассказывать,0.5,0.2903225806451613
82,02b7f2edb748.wav,если все что влияет на нашей поступке мы объединим в категорию сигнал,если всё что влияет на наши поступки мы объединим в категорию сигнал,0.25,0.0588235294117647
83,02bee1265c1b.wav,между тримя занятиями,между тремя занятиями,0.3333333333333333,0.0476190476190476
84,02c12f302ab1.wav,только по одной пичине там,нужна только по одной причине,0.6,0.3793103448275862
85,02d32a2357de.wav,и она повторялась так много раз,и она повторялась так много раз,0.0,0.0
86,02d7c54dd98a.wav,или все р жбазон такой млодой,или серж бозон такой молодой,0.8,0.2142857142857142
87,02e3a45840ec.wav,если дара нет то не стоит и пытаться,и если дара нет то не сто ит и пытаться,0.3,0.0769230769230769
88,02e612735c96.wav,мышечного движения фиксировался с помощью илектра миографа,процесс мышечного движения фиксировался с помощью электромиографа,0.4285714285714285,0.1692307692307692
89,02e7b3d5211c.wav,которую есть свои даже маленький пуска детские цели,у которого есть свои даже маленькие пускай детские цели,0.4444444444444444,0.1272727272727272
90,02f077ca6e79.wav,будет куплено кем-то очень задеживо,или будет куплена кем то очень задёшево,0.7142857142857143,0.2307692307692307
91,02f0baf0a76a.wav,тыи может мы что засмушем сделать для человека,и может мы что то сможем сделать для человека,0.3333333333333333,0.1555555555555555
92,02fa03b45020.wav,умела так как в книжках пишут знаетес,умерла так как в книжках пишут,0.3333333333333333,0.3
93,0303c16e2c96.wav,осмествальский мир стал миром суверенных государств,поствестфальский мир стал миром суверенных государств,0.1666666666666666,0.0754716981132075
94,03155d91efad.wav,то мы можем вступать в историческую эпоху когда вот ити вот единые унифицированм,то мы можем вступать в историческую эпоху когда эти единые унифицированные,0.3636363636363636,0.1621621621621621
95,03164612754a.wav,необходимо каждый день выходите из свои зоны комфорта,необходимо каждый день выходить из своей зоны комфорта,0.25,0.0555555555555555
96,0316a1545b8c.wav,точно мы в своей работе занимаемся это по сути мы находим и представляем тилины интерпретатьси,то чем мы в своей работе занимаемся мы находим те или иные интерпретации,0.6923076923076923,0.4722222222222222
97,03187d34b3f5.wav,у науки есть три проблемы в передаче знаний которое надо бывае,у науки есть три проблемы в передаче знаний которые она добывает,0.2727272727272727,0.078125
98,031cce7cd86b.wav,и эта встреча вовсе не всегда была конфликтной,и эта встреча не всегда была конфликтной,0.1428571428571428,0.15
99,03252189737a.wav,ваша полеснинца подтверждает,ваши аплодисменты подтверждают,1.0,0.3333333333333333
100,03307d92e58c.wav,что в какой-тот момент мы входим в пародди,что в какой то момент мы входим в парадигму,0.3333333333333333,0.1627906976744186
101,03400eb8f86d.wav,думая о белкик вам могут в голову прети мыслеэш,с думами о белке к вам в голову могут прийти мысли,0.7272727272727273,0.44
102,034a46fa086e.wav,вобще м тебе понадбится ум труда люби усердие дняна любовь и алкоколй,тебе понадобится ум трудолюбие усердие любовь и алкоголь,0.875,0.3571428571428571
103,0355ac89e4e9.wav,как возрождение постельного промысла,о возрождении пастельного промысла,0.75,0.1470588235294117
104,035620b9ecc3.wav,как например делать участники сайта поцента как я,как например делают участники сайта пациенты как я,0.25,0.1
105,0364e2d9bd24.wav,и тогда я братил внимание на свою визитку,и тогда я обратил внимание на свою визитку,0.125,0.0238095238095238
106,036fdf327c95.wav,насмешкив свой адрес,но и насмешке в свой адрес,0.6666666666666666,0.2692307692307692
107,03849374037a.wav,там что-то прочетали там видели в тилиниза,если вы что то прочитали увидели в телевизоре,0.875,0.4222222222222222
108,0388ee6ed6d9.wav,хотите быть свободным используйте рефлексию,хотите быть свободным используйте рефлексию,0.0,0.0
109,038e4176e80b.wav,таекой переключатель которые или переключает клетку как табо включа,это такой переключатель который когда его включаешь,1.2857142857142858,0.6862745098039216
110,038f2c319d22.wav,мы все решили за своих детей с момента их рождения,мы всё решили за своих детей с момента их рождения,0.1,0.02
111,039b4d56cfcc.wav,и то же что-то больше симухли правда,это уже что то большее чем хлеб правда,0.875,0.2631578947368421
112,03a24c315d0c.wav,это и сеправильно понимаю,это если я правильно понимаю,0.6,0.1785714285714285
113,03ab9413fd79.wav,отораю вероятно смерти с возрастом не увеличивается,у которых вероятность смерти с возрастом не увеличивается,0.375,0.1403508771929824
114,03bef5094399.wav,опять жевопреки тому что мы можем себе предстать,опять же вопреки тому что мы можем себе представить,0.3333333333333333,0.0588235294117647
115,03bfcb356cf1.wav,стобы лебить отцветно нужно оставаться ребенком,но чтобы любить этот свет нужно оставаться ребёнком,0.75,0.2352941176470588
