,filename,transcription,text,wer,cer
1619,3d0c78ec53ee.wav,какой должна быть роль мужчины какой женщина,какой должна быть роль мужчины какой женщины,0.1428571428571428,0.0227272727272727
1620,3d241f300c42.wav,необразованностью дешевый славый вынечтающих подростков,необразованностью дешёвой славой у нечитающих подростков,0.6666666666666666,0.1071428571428571
1621,3d257ea6df25.wav,с одним исключением его родители ничерта не пониматься боле,с одним исключением его родители ни черта не понимают в футболе смех,0.5,0.1911764705882352
1622,3d27cce00169.wav,я не успею вам раскать бросвые школы я тольк,я не успею вам рассказать про свою школу,0.625,0.4
1623,3d40e00d013d.wav,мы проводим наш фокнулка за продлений жизнь,мы фонд наука за продление жизни,0.8333333333333334,0.46875
1624,3d5d8e36a461.wav,способному к нере активному поведению,способностью к нереактивному поведению,0.75,0.131578947368421
1625,3d71face9265.wav,кто сравнел ножени скорби прирос скорби а перироста ни знанья,кто сравнивал умножение скорби прирост скорби от прироста незнания,0.7777777777777778,0.1969696969696969
1626,3d7817e366a3.wav,в любых возможных ракурсах,в любых возможных ракурсах,0.0,0.0
1627,3d7cf53943c5.wav,никита разбрасвал конусы пенал мичи ва все стороны,никита разбрасывал конусы пинал мячи во все стороны,0.5,0.0784313725490196
1628,3d80304c0b01.wav,и мы как часть живой природы,и мы как часть живой природы,0.0,0.0
1629,3d86b944ab6f.wav,в отношения к своему сыну прехлетем цын,по отношению к своему трёхлетнему сыну,0.8333333333333334,0.3684210526315789
1630,3d89c1cc021f.wav,он сказал как бы лучше стал мир если бы люди всегда помогали ь другдругу,он сказал как бы лучше стал мир если бы люди всегда помогали друг другу,0.1428571428571428,0.0422535211267605
1631,3d98fa3b0a94.wav,не спрашивайте мне почему,не спрашивайте меня почему,0.25,0.0769230769230769
1632,3d9d8aeff90a.wav,создавь свою профессию вам не нужно будет выбирать,и создав свою профессию вам не нужно будет выбирать,0.2222222222222222,0.0588235294117647
1633,3da81d2d15f8.wav,она про каждого изна,она про каждого из нас,0.4,0.0909090909090909
1634,3dac56d73aae.wav,и накапливаются сагнассетные дряхмое предки,и накапливаются сенесцентные дряхлые клетки,0.6,0.2325581395348837
1635,3dc4c38e9e39.wav,есть предположения что города и союзы городов будут центрами прогресса сте,есть предположение что города и союзы городов будут центрами прогресса,0.2,0.0714285714285714
1636,3de3ed5c446b.wav,писмы присоеднился всё дебетом крашам,ты сюда присоединился и всё у тебя там хорошо,0.8888888888888888,0.4444444444444444
1637,3deb480a0f8a.wav,здесь седенеты целых два удовольствия,здесь соединяются целых два удовольствия,0.2,0.15
1638,3df446dfba61.wav,художно обрез в искусстве возникает всегда,художественный образ в искусстве возникает всегда,0.3333333333333333,0.1836734693877551
1639,3e2301e231a5.wav,который кресет моденс,который крестит младенца,0.6666666666666666,0.25
1640,3e35c181e815.wav,гораздо легче и результативе,гораздо легче и результативнее,0.25,0.0666666666666666
1641,3e53e6f6498f.wav,натмердри в континентов орадиинен антарктиды измени рбитой земли,например дрейф континентов оледенение антарктиды изменение орбиты земли,0.625,0.2676056338028169
1642,3e55d96c6476.wav,и именно если все проговорено и честно,и именно если всё проговорено и честно,0.1428571428571428,0.0263157894736842
1643,3e6503da4454.wav,когда она уснет пойдешь ко мне,когда она уснёт пойдёшь ко мне,0.3333333333333333,0.0666666666666666
1644,3e654211bb52.wav,закваску дузнокомить раженой мукой,закваску до лжно кормить ржаной мукой,0.6666666666666666,0.2162162162162162
1645,3e7c807cf1a8.wav,и воты за наследия эт историй вдохновляет,и вот это наследие эта история вдохновляет,0.7142857142857143,0.1666666666666666
1646,3e830592f1e3.wav,свой ответ на этот вопрос возможно они были совершенно разные но он был,свой ответ на этот вопрос возможно они были совершенно разные но он был,0.0,0.0
1647,3e9016ae4490.wav,музыке  это звук это ритм в танце это пластика тела,в музыке это звук это ритм в танце это пластика тела,0.0909090909090909,0.0576923076923076
1648,3e91fcc1cfe9.wav,и духовный рост и удовлетворение всех моих потребностей и монационсть,и духовный рост и удовлетворение всех моих потребностей эмоциональных и иных,0.1818181818181818,0.2105263157894736
1649,3e9310a3d906.wav,выбора нет на самом деле,там выбора нет на самом деле,0.1666666666666666,0.1428571428571428
1650,3e94d395c1f0.wav,все дело в том что это пример работы того самого автоматического механизма,всё дело в том что это пример работы того самого автоматического механизма,0.0833333333333333,0.0135135135135135
1651,3e9a236d3596.wav,знает всеобщество активно поддерживает эту инфантильность,знаете общество активно поддерживает эту инфантильность,0.3333333333333333,0.0727272727272727
1652,3ea0f3b55b4e.wav,можно ли как-то нам так повлиять на спортсмена поменяв его бактерие,можно ли нам как то так повлиять на спортсмена поменяв его бактерии,0.3333333333333333,0.1492537313432835
1653,3ebd2f05cf1d.wav,как научеьть чувствовать я не знала,как научить чувствовать я не знала,0.1666666666666666,0.0588235294117647
1654,3ec3f6189a8e.wav,указательный палец на правы руки это происходит де-то в нашем сознаке,указательный палец на правой руке это происходит где то в нашем сознании,0.4166666666666667,0.1111111111111111
1655,3edcadb06e65.wav,когда им было принято решение поднять палец,когда им было принято решение поднять палец,0.0,0.0
1656,3edf80fa6418.wav,в масштабах страны о на самом белене о чем,но в масштабах страны это на самом деле ничего,0.5555555555555556,0.2608695652173913
1657,3ee1ced2a832.wav,зризев на них не пойдет зволая омноголетним романина,но он боится что зритель на них не пойдёт забывая о многолетнем романе,0.7692307692307693,0.4285714285714285
1658,3ee3e0ab06fa.wav,то что я сам выбрал за это я и отвечаю,то что я сам выбрал за это я и отвечаю,0.0,0.0
1659,3ee4e897cbc5.wav,выйдели должное коричество тесо и жилезо,выделить должное количество тёса и железа,0.6666666666666666,0.1951219512195122
1660,3eed7fd33f1e.wav,сталкиваясь радостное и фантастическо и создают такуй такую картину миру,сталкиваясь радостное и фантастическое создают такую картину мира,0.5,0.1384615384615384
1661,3f1237f52624.wav,нажно уже в таком бооде,неважно уже по какому поводу,0.8,0.3214285714285714
1662,3f18c5551172.wav,мне из замечательная карта окотором написана вы воскитительны,у меня есть замечательная карта на которой написано вы восхитительны,0.7,0.2058823529411764
1663,3f1aa1eec673.wav,а его все нет,а его всё нет,0.25,0.0769230769230769
1664,3f1ad1653f6c.wav,что одеть умершего довольно трудно,что одеть умершего довольно трудно,0.0,0.0
1665,3f226a530721.wav,подругать попробовать бещуты,потрогать попробовать без счёту,0.75,0.2580645161290322
1666,3f24898f02dd.wav,исходят изпредположение о самодостаточности материи,по прежнему исходит из предположения о самодостаточности материи,0.625,0.234375
1667,3f2a84f421dd.wav,стлети пайдзон ы говорит там начинается все с французского языка,а есть третьи пансионы там всё начинается с французского языка,0.6,0.4193548387096774
1668,3f2fa52c31df.wav,и это туже довнавляещь аргумент что поту роберту,и это тоже вдохновляющий аргумент что вот роберту,0.375,0.1836734693877551
1669,3f335a727cb8.wav,дает ему ключи от спальней графини,лиза даёт ему ключи от спальни графини,0.4285714285714285,0.2105263157894736
1670,3f362e2ff2b9.wav,более того каждому из них мы рассказали,более того каждому из них мы рассказали,0.0,0.0
1671,3f53577363ac.wav,аеено также общество есть четкий план вже в тот момен,примерно так же у общества есть чёткий план уже в тот момент,0.6666666666666666,0.2
1672,3f5b42f023f5.wav,следующий пункт это отношение к привы,следующий пункт это отношение к привычкам,0.1666666666666666,0.0975609756097561
1673,3f5dad4bcd50.wav,гес даже намек на робость,есть даже намёк на робость,0.4,0.1538461538461538
1674,3f61762a4688.wav,подождите водождите,подождите подождите,0.5,0.0526315789473684
1675,3f62d54ceee6.wav,предприниматель в этом смысле ведет себя просто ка киборг,предприниматель в этом смысле ведёт себя просто как киборг,0.2222222222222222,0.0344827586206896
1676,3f793e842600.wav,а что же запрещает каком-то не знаю день директор в какой-то б компьютерный программе скате,а что же запрещает какому то гендиректору в компьютерной программе сказать,0.8181818181818182,0.3918918918918919
1677,3f7e51f236b7.wav,мы будем хуже слышать хуже видеть,мы будем хуже слышать хуже видеть,0.0,0.0
1678,3f82d1378fe1.wav,я прошу ее вспомнить у физических ощущение,и я прошу её вспомнить о физических ощущениях,0.5,0.1333333333333333
1679,3f8dd97fe0e6.wav,сейчас же под бесконечный разговору просторянул пронаследство,и сейчас же под бесконечные разговоры про старину про наследства,0.7,0.15625
1680,3f8ed27270b1.wav,таким как всевостопль сочье ниж нетогил,таким как севастополь сочи нижний тагил,0.6666666666666666,0.2564102564102564
1681,3f949dd9b58e.wav,есть у нас людей такая способность возможность как встроеная прошибка,есть у нас у людей такая способность возможность как встроенная прошивка,0.2727272727272727,0.0555555555555555
1682,3fb2374f89fc.wav,которые хотели бы именно от вас что-то услышать чтоб вы им сказали,которые хотели бы именно от вас что то услышать что бы вы им сказали,0.2857142857142857,0.0441176470588235
1683,3fb8e5dd5711.wav,чувство можно выразить цвете но дело в том что в искуссте,чувство можно ведь выразить но дело в том что в искусстве,0.2727272727272727,0.2105263157894736
1684,3fb98f77c258.wav,и начать жить свое жизнью,и начать жить своей жизнью,0.2,0.0384615384615384
1685,3fbbef934570.wav,строили ты воронке кандидатов или воронкий продаш как маркиценге,строили эти воронки кандидатов или воронки продаж как в маркетинге,0.6,0.1515151515151515
1686,3fbc3173d0ae.wav,во-первых строгой научное знание всегда специфично,во первых строгое научное знание всегда специфично,0.4285714285714285,0.04
1687,3fcc77d4180f.wav,это бюджет ведущегосэдецельского центра в мире пасаясье постареню,это бюджет ведущего исследовательского центра по старению в мире,0.6666666666666666,0.46875
1688,3fd4f10aae4a.wav,поэто недемократические правил,это не демократическое правило,1.0,0.1666666666666666
1689,3fd597843eb3.wav,всей части коммоциональную интеллектуальную эротическую,все части эмоциональную интеллектуальную эротическую,0.4,0.0769230769230769
1690,3fd7e26caeca.wav,течки поют,птички поют,0.5,0.1818181818181818
1691,3fe914da14d8.wav,чнить то человек моей профессии по эту художнику разной роли,то человеку моей профессии поэту художнику разные роли,0.625,0.1851851851851851
1692,3ff6ad6d668b.wav,сложнейших социальных систем которыми обладают и те и другие хстаия,сложнейших социальных систем которыми обладают и те и другие,0.1111111111111111,0.1166666666666666
1693,3ffe177683ba.wav,давайте посмотрим как может быть выговеть в комплексный подход,давайте посмотрим как может выглядеть комплексный подход,0.4285714285714285,0.1785714285714285
1694,400124568d7f.wav,про каждого человека мы узнали достаточно много,про каждого человека мы узнали достаточно много,0.0,0.0
1695,4007affb3c66.wav,но пообщавшись с людьми было понятно что это явление действительно существует,но пообщавшись с людьми было понятно что это явление действительно существует,0.0,0.0
1696,40123416483a.wav,что такой старени,что такое старение,0.6666666666666666,0.1111111111111111
1697,4014471d5c96.wav,друзья он даже не позвонил,друзья он даже не позвонил,0.0,0.0
1698,401a052a9275.wav,смысле предназначение природе счастья и радости,о смысле предназначении природе счастья и радости,0.2857142857142857,0.0612244897959183
1699,401c749be150.wav,кто-то отправился в это путешествие первым,кто то отправился в это путешествие первым,0.2857142857142857,0.0238095238095238
1700,4026f4e0034e.wav,печатного станка и гравюры на дери,печатного станка и гравюры на дереве,0.1666666666666666,0.0833333333333333
1701,4037ae56dfd6.wav,он объясняет почему ниграть я с,он объясняет почему он не играет,0.5,0.34375
1702,404bb35d70ba.wav,ишил я даноужно основать что-то альтернативное,решил я тогда нужно основать что то альтернативное,0.625,0.16
1703,404fcdcb0f84.wav,затем подняться отдышаться,затем подняться отдышаться,0.0,0.0
1704,4050c2ff59ff.wav,всю зязнь был чистливым всю жизнь наобще,ведь всю жизнь был счастливым всю жизнь вообще,0.5,0.2391304347826087
1705,40514c13017b.wav,я повернулась и выдела ребенка у которую ей свои интересым,я повернулась и увидела ребёнка у которого есть свои интересы,0.5,0.1639344262295081
1706,405bcebd1aad.wav,ну всего остального что,ну и всего остального,0.5,0.2857142857142857
1707,40793640d9a6.wav,пока вото то все не произойдет,пока вот всё это не произойдёт,0.6666666666666666,0.2666666666666666
1708,407f2a375694.wav,он не знает имя скульптора,он не знает имя скульптора,0.0,0.0
1709,409fe700885a.wav,тигорь активное топливо парит взлют в подцос,некоторые тяга реактивное топливо пари т взлёт подсос,0.875,0.3584905660377358
1710,40a780ad043a.wav,вот сегодня дим алексеев говорило кроудфанья,вот сегодня дима алексеев говорил о краудфандинге,0.5714285714285714,0.1632653061224489
1711,40b3f3b54633.wav,я читала его завещание в завещании был написано последнее,я читала его завещание в завещании была написана последняя фраза,0.4,0.15625
1712,40d5e3f61432.wav,поверсе вдвоем втроем вместе бежать этот марофон в жизни,то поверьте вдвоём втроём вместе бежать этот марафон жизни,0.6666666666666666,0.1724137931034483
1713,40e188856091.wav,если мы один день в неделю откажемся от мяса,потому что если мы один день в неделю откажемся от мяса,0.1818181818181818,0.2
1714,40e7a41eaa06.wav,гроз утверждал что этот образ означает страдающее человечество,гросс утверждал что этот образ означает страдающее человечество,0.125,0.0317460317460317
1715,411a55463036.wav,они улетают,они улетают,0.0,0.0
1716,411ac704dde8.wav,но все понимают что впереди хотя откровенных разговоров с ним не было,всё можно все понимают что впереди хотя откровенных разговоров с ним не было,0.1538461538461538,0.0921052631578947
1717,4126ac0ee67d.wav,если у вас есть дети задумайтесь об этом,если у вас есть дети задумайтесь об этом,0.0,0.0
1718,413c474fceca.wav,и наверная будем умирать узнаем,и наверное будем умирать узнаем,0.2,0.064516129032258
1719,413d2a05c929.wav,не потому что так надо а потому что там есть хорошая работа,не потому что так надо а потому что там есть хорошая работа,0.0,0.0
1720,4146b2bf5fed.wav,вокруг него испытывающие глубокий трепятые в уважений учелики,вокруг него испытывающие глубокий трепет и уважение ученики,0.5,0.1016949152542373
1721,414f443dc0d6.wav,это была другая бомба понимайте ведь,это была другая бомба понимаете,0.4,0.1935483870967742
1722,416bae94bd5e.wav,и в наших руках научить их получать удовольстве здесь сейла,и в наших руках научить их получать удовольствие здесь и сейчас,0.2727272727272727,0.0793650793650793
1723,4189a940bff6.wav,ну что такого,ну что такого,0.0,0.0
1724,4193178c52a5.wav,вы пропагандируете расизм,вы пропагандируете расизм,0.0,0.0
1725,4199dd6d13af.wav,если речь идет о человеки которой называет себя учон,тем не менее если речь идёт о человеке который называет себя учёным,0.5833333333333334,0.2835820895522388
1726,419b6ffbb535.wav,они говорят так,они говорят так,0.0,0.0
1727,41a0dbecc608.wav,миграционных подогов второю это толокаснополитизм меня т,миграционных потоков,3.0,1.85
1728,41a48a4a93d9.wav,вод я быквально представляй чтобу через один годек мнет,и я представляю что будет через один годик,0.75,0.5714285714285714
1729,41be8b74d2a8.wav,к сожалению эти поиски они никчемо не привели,но к сожалению эти поиски ни к чему не привели,0.4,0.1739130434782608
1730,41c2fe15f205.wav,глубокой глубинкий в бедности в простоте,глубокой глубинке в бедности в простоте,0.1666666666666666,0.0512820512820512
1731,41e3c3d0eb86.wav,в таком крохотном городе где средни статистический мужик,в таком крохотном городе где среднестатистический мужик,0.2857142857142857,0.0363636363636363
1732,41e5019fab57.wav,что вот она наше вторая натура которая как будто стала первой,что вот она наша вторая натура которая как будто стала первой,0.0909090909090909,0.0163934426229508
1733,41fe16970776.wav,на самом деле такая простая математическая задачкав,на самом деле это такая простая математическая задачка,0.25,0.0925925925925925
1734,41ffbc58a1e0.wav,чтобы как-то уточнить эту гипотезу,чтобы как то уточнить эту гипотезу,0.3333333333333333,0.0294117647058823
1735,4200c6e43f05.wav,их не испугало то что нужно было сдавать анализы,их не испугало то что нужно было сдавать анализы,0.0,0.0
1736,42116188e4b5.wav,но если посмотреть на эволюции то становится понятнос,но если посмотреть на эволюцию то становится понятно,0.25,0.0384615384615384
