,filename,transcription,text,wer,cer
5098,be110d074cbf.wav,не может быть это какое-то волшебство,этого не может быть это какое то волшебство,0.375,0.1627906976744186
5099,be21c358a1aa.wav,надо вам сказать что удивительным образом,надо вам сказать что удивительным образом,0.0,0.0
5100,be3d4fc3f9d7.wav,которую делают  совуршенно неамерикански дежесеры,которые делают совершенно неамериканские режиссёры,0.8,0.18
5101,be48300b5aaf.wav,он реагирует но не воспринимают,он реагирует но не воспринимает,0.2,0.032258064516129
5102,be4ae258e88d.wav,как невыносимые прежде всего акустическое загрязнение их среды обитания,как невыносимое прежде всего акустическое загрязнение их среды обитания,0.1111111111111111,0.0140845070422535
5103,be6005c25601.wav,интерес был простойсбулду не помирить слезимой не замерснуть,общий интерес был простой с голоду не помереть зимой не замёрзнуть,0.6363636363636364,0.2727272727272727
5104,be669af18e77.wav,от безудежных плясок до судоровых,от безудержных плясок до судорог,0.4,0.125
5105,be73b0361991.wav,ертал личе открывай двере ко всяким разным чиновникам,лизе алерт стало легче открывать двери к разным чиновникам,0.7777777777777778,0.4137931034482758
5106,be758a494f99.wav,я никогда этого не дела потому точитаето неправильном  и,я никогда этого не делаю потому что считаю это неправильным,0.5,0.1864406779661017
5107,be771da6a158.wav,говори что им нравиться идеи они хотятбы участвовать теже реализации,и говорить что им нравится идея и они хотят поучаствовать в её реализации,0.6923076923076923,0.1917808219178082
5108,be85157ceb18.wav,поэтому он покупает чужое вр,поэтому он покупает чужое время,0.2,0.0967741935483871
5109,be8b0c7aa09d.wav,это наше нежелание нести ответственны за свои отношения,это наше нежелание нести ответственность за свои отношения,0.125,0.0689655172413793
5110,be922536eb7c.wav,поэтому и становясь зрослами мы тоже отслеживаем лица других людей,поэтому и становясь взрослыми мы тоже отслеживаем лица других людей,0.1,0.0298507462686567
5111,be950e52ec1a.wav,бесмежители начали рассказать дбе разные веши я потье,местные жители начали рассказывать мне разные вещи,1.0,0.36
5112,be96577b9084.wav,растак зачета давайте посмотрим как и не уз,а раз так значит давайте посмотрим как они устроены,0.7777777777777778,0.3333333333333333
5113,be96763f5015.wav,а есьу водна которых такого процесса нет,а есть животные у которых такого процесса нет,0.375,0.2
5114,bea9b0abbc73.wav,не при каких условиях,слышите ни при каких условиях,0.4,0.3103448275862069
5115,bebe68695f10.wav,и очень обидезасына крылово,и очень обиделся на крылова,0.6,0.1851851851851851
5116,beda789c8771.wav,ребятну если это так тогда это ключ,ребят ну если это так тогда это ключ,0.25,0.0277777777777777
5117,bede7759a70e.wav,осман постеблоты класнотом,осман баскетбол это классно,0.75,0.4444444444444444
5118,bef764efa9f8.wav,обы гида облагодает важнейшим признаком разума,оба вида обладают важнейшим признаком разума,0.5,0.1136363636363636
5119,bf0196d86480.wav,с кем-то изврачии сложились более довелить най отношении,с кем то из врачей сложились более доверительные отношения,0.7777777777777778,0.1896551724137931
5120,bf04ec269752.wav,в кристолической ичейке со сума,в кристаллической ячейке социума,1.0,0.15625
5121,bf0ca5020b1a.wav,сначала он на большом как блисте придумывать новую стратегию,сначала он на большом листе придумывает новую стратегию,0.375,0.1272727272727272
5122,bf128c0305a6.wav,для этого даже не обязательно был сумасшедшим обтинест набоди мня,для этого даже не обязательно быть сумасшедшим оптимистом вроди меня,0.4,0.1617647058823529
5123,bf1e79dacedc.wav,гдак же вот опознать оказалось просто  на свийствать,как же его опознать а оказалось просто насвистывать,0.625,0.2156862745098039
5124,bf23877d6360.wav,у нас рушается метоболизм,у нас нарушается метаболизм,0.5,0.1111111111111111
5125,bf3912a049fc.wav,лекопитающем берег в общем не зачем не нугм,потому что водным млекопитающим берег в общем низачем не нужен,0.7,0.4032258064516129
5126,bf3a5e8c01d4.wav,свое желание второго порядка,когда я реализовал своё желание второго порядка,0.5714285714285714,0.425531914893617
5127,bf452a5e31f4.wav,а верхний стекла окон цветные синие и любовые,а верхние стёкла окон цветные синие и лиловые,0.375,0.0888888888888888
5128,bf4f2244bc19.wav,это возлагает на современного человека ответственнот,это возлагает на современного человека ответственность,0.1666666666666666,0.037037037037037
5129,bf55e8af547b.wav,не был дедушка интеллигентни чо человек,у неё был дедушка интеллигентнейший человек,0.6666666666666666,0.1860465116279069
5130,bf58b5372d3b.wav,я уже вся нарядная красная помада шпильке,я уже вся нарядная красная помада шпильки,0.1428571428571428,0.024390243902439
5131,bf5db23097c5.wav,идут о ни помузею,идут они по музею,0.75,0.1176470588235294
5132,bf622819e409.wav,когда богля точтал люди уже не могли говорить с,там когда гоголь это читал люди уже не могли говорить,0.5,0.2264150943396226
5133,bf664a4561f7.wav,а соответственно до этого в ня эпоху дридзонных обществ,а соответственно до этого в эпоху традиционных обществ,0.25,0.1481481481481481
5134,bf6dbb60c6c7.wav,етлюдь на самом деле они там все знают,эти люди на самом деле и так всё знают,0.5555555555555556,0.2105263157894736
5135,bf765e629a5b.wav,потому что она никогда не видел его таким,потому что она никогда не видела его таким,0.125,0.0238095238095238
5136,bf78b6c27e59.wav,а потом ребенок становится старше и нам привод итей постарше,а потом ребёнок становится старше и нам приводят детей постарше,0.3,0.0793650793650793
5137,bf7c1da18e25.wav,я думаю что вы узнаете себя и,я думаю что вы узнаёте себя,0.3333333333333333,0.1111111111111111
5138,bf88742d78dc.wav,в насдавление скачет сахра в крайй,у нас давление скачет сахар в крови,0.7142857142857143,0.2
5139,bf8f67997f5e.wav,героя спектакля кукла по имене воль в гонк,главный герой спектакля кукла по имени вольфганг,0.8571428571428571,0.3125
5140,bf91a8d97ffd.wav,становится вд йте синей точки,становятся вот эти синие точки,0.8,0.2333333333333333
5141,bf91f9d84880.wav,секторы перед вами обнаженной крубзе которое любил заниматься жилопи,перед вами обнажённый ле корбюзье который любил заниматься живописью,0.6666666666666666,0.3382352941176471
5142,bfa1184ea93a.wav,превратиться со временем времестника в торговцы открытками  стихами,превратиться со временем в ремесленника в торговца открытками со стихами,0.4,0.0972222222222222
5143,bfb101db612f.wav,десятк если несут не веществ которое или там генной тыропии,я знаю десятки если не сотни веществ которые или генную терапию,0.8181818181818182,0.3492063492063492
5144,bfb2b1eb166e.wav,а тому как как строит отношения созданно,а тому как строить отношения осознанно,0.5,0.1842105263157894
5145,bfb7349fc272.wav,она заключалась в тому чту,она заключалась в том,0.5,0.238095238095238
5146,bfbfe49eaf57.wav,тем сложнее остановилось поведение животного,тем сложнее становилось поведение животного,0.2,0.0232558139534883
5147,bfc55bc14307.wav,один это хозяйственная часть бязанийка шильков,хозяйственная часть вязание кошельков,1.0,0.4054054054054054
5148,bfcb6e4fb988.wav,и все и что же буду дальше дель,и всё и что же я буду дальше делать,0.3333333333333333,0.1428571428571428
5149,bfd43d211fdd.wav,это то что вы имеете каждый день,это то что вы имеете каждый день,0.0,0.0
5150,bfdaaca4dad8.wav,какие страхи есть перед понедельниками без меса,какие страхи есть перед понедельниками без мяса,0.1428571428571428,0.0212765957446808
5151,bfdb52f67cb0.wav,я могу высрезить ладушки так далее и так далее,я могу вытереть эти ладошки и так далее,0.5,0.4358974358974359
5152,bfdc6171ebb7.wav,мне скажут нельзя собать пальце в разе,мне скажут нельзя совать пальцы в розетку,0.4285714285714285,0.1463414634146341
5153,bfddb123212a.wav,ее вообще главная чертана все заботилась оо,вообще её главная черта что она всегда заботилась о ком то,0.8181818181818182,0.3620689655172414
5154,bfe3894c20ad.wav,может научить каго угодно офицера инженера ученого врача чиновника килера,может научить кого угодно офицера врача инженера учёного чиновника киллера,0.5,0.2027027027027027
5155,bff1da0ca9f0.wav,когда люди может не так стовидели друг друга часта,когда люди может не так видели друг друга часто,0.2222222222222222,0.0851063829787234
5156,bffa8145c3b7.wav,я подумал о том что это на самдель достаточно универсальное мета,я подумал о том что это на самом деле достаточно универсальная метафора,0.3333333333333333,0.1408450704225352
5157,bffb1732deba.wav,это оттого что дума кружом садом,это оттого что дом окружён садом,0.3333333333333333,0.15625
5158,bfffdb85aa49.wav,я тебя люблю,я тебя люблю,0.0,0.0
5159,c000387506ff.wav,и они подходили камнотацией которуе стоял льрь,они подходили к аннотации которая стояла рядом,0.8571428571428571,0.3043478260869565
5160,c0020ad52608.wav,самого информационного потука,этого самого информационного потока,0.5,0.2
5161,c00b99f8cf01.wav,ас другой категорий я понимаю я понимаю отглубину этого противореча нитц,я отношусь к другой категории я понимаю глубину этого противоречия,0.8,0.4242424242424242
5162,c00de50dcd5f.wav,да мы учены и сталкиваемся вообще то с ней всегда,да мы учёные сталкиваемся вообще то с ней всегда,0.2222222222222222,0.0625
5163,c0152b39f032.wav,это надо делать маленькие маленькие такие азисы,это надо делать маленькие маленькие такие оазисы,0.1428571428571428,0.0208333333333333
5164,c01b9d62e98d.wav,и вот один из таких проектов для на стало сотрудничать с оргония,и одним из таких проектов для нас стало сотрудничество,0.6666666666666666,0.3333333333333333
5165,c023075b575b.wav,где делая новый шаг ты не знаешь что тебя там ждет,где делая новый шаг ты не знаешь что тебя там ждёт,0.0909090909090909,0.02
5166,c028e6909650.wav,того что можно назвать истории в режиме реального времени,того что можно назвать историей в режиме реального времени,0.1111111111111111,0.0344827586206896
5167,c02dcd369a53.wav,вуконо череспару мисяцев вы стаграми под эгудобро неизбежни,буквально через пару месяцев в инстаграме по тегу добронеизбежно,1.0,0.28125
5168,c03185ad630a.wav,куходит и с тех которыми он занимался ещё вчера,и легко уходит из тех которыми он занимался ещё вчера,0.4,0.1698113207547169
5169,c0319d852f04.wav,он вдруг стал участвовать,он вдруг стал участвовать,0.0,0.0
5170,c03a6b97fbfe.wav,выясняется потом подтверждается,сначала выясняется потом подтверждается,0.25,0.2051282051282051
5171,c03ef746f257.wav,решил он отыскать лепован человека у которого не спортил на подготовке,я решила отыскать слепого человека у которого нет спортивной подготовки,0.7,0.2112676056338028
5172,c0412b84195c.wav,не начали общаться сальтуристами ни о погоде,и они начали общаться с альтуристами не о погоде,0.5555555555555556,0.125
5173,c04ec0a9d1f4.wav,на нашем желании  перебирать все время новое,на нашем желании перебирать всё время новое,0.1428571428571428,0.0465116279069767
5174,c051baf09b3b.wav,еще более важно то что в то время происходит церковный раскол,ещё более важно то что в это время происходит церковный раскол,0.1818181818181818,0.032258064516129
5175,c05c496b03c8.wav,но то что многие из вас видели на картин как с подписью моск,но то что многие из вас видели на картинках с подписью мозг,0.25,0.0677966101694915
5176,c071207e1b14.wav,куда я знаю да я проделлых сто роз двесте триста,откуда я знаю да я проделал это сто раз двести триста,0.4545454545454545,0.1698113207547169
5177,c0780ccdd26f.wav,и продолжают напяливать шапку на свою чадо,и продолжают напяливать шапку на своё чадо,0.1428571428571428,0.0238095238095238
5178,c096285b2e6d.wav,это правдо ействительно кинул и выпол,это правда я действительно кинул и выпал,0.5714285714285714,0.125
5179,c0afa74fd97b.wav,это значит что мы почти не опираемся на свое субъективное мнени,это значит что мы почти не опираемся на своё субъективное мнение,0.1818181818181818,0.03125
5180,c0b3b7de918c.wav,бабушка моя и стого поколение человек,бабушка моя из того поколения человек,0.5,0.081081081081081
5181,c0b5ce7c7484.wav,вот представить себе что такой флышкь,представить себе что такой флешмоб мог бы происходить,0.625,0.490566037735849
5182,c0b9cbfbb3fa.wav,а в российсну б жена такой осторожный надписе что,а в россии была снабжена такой осторожной надписью,0.75,0.32
5183,c0cc2f8231fe.wav,никогда не знал сколько простоейшего ожидания,и ты никогда не знал сколько простоишь в ожидании,0.5555555555555556,0.2244897959183673
5184,c0f36cd4b5a5.wav,се инструменты которые зарекомендовали себя наиболее эфективы,те инструменты которые зарекомендовали себя наиболее эффективно,0.2857142857142857,0.0634920634920634
5185,c0f8fd6c6383.wav,но посмотрите откуда она пришла,ну посмотрите откуда она пришла,0.2,0.032258064516129
5186,c0fe07168ed0.wav,увы  это уже уникальная ситуация для россии,увы это уже уникальная ситуация для россии,0.0,0.0238095238095238
5187,c0feeaad3fbf.wav,отратить еще не заработанные нами деньги,как потратить ещё не заработанные нами деньги,0.4285714285714285,0.1333333333333333
5188,c104c41e5aee.wav,акими будут эти идеи и какой следующий мир,какими будут эти идеи и какой следующий мир,0.125,0.0232558139534883
5189,c10c4c6e8a38.wav,когда устречайте свою собственную мысль в чажун тек,когда вы встречаете свою собственную мысль в чужом тексте,0.4444444444444444,0.1929824561403508
5190,c11cb6613840.wav,для того чтобы у человека была возможность,для того чтобы у человека была возможность,0.0,0.0
5191,c1225ada54a1.wav,с вариантов не меньше трех я поговоря о случай когда два,и число вариантов не меньше трёх я поговорю о случае когда два,0.4166666666666667,0.1451612903225806
5192,c12486c02414.wav,которые предшествуют каждому ее скандал,которые предшествуют каждому её скандалу,0.4,0.05
5193,c132b54aa236.wav,сржен другой расклад совершенно другие сильмы,совершенно другой расклад совершенно другие фильмы,0.3333333333333333,0.14
5194,c1372e06595b.wav,я вообразила себе как как оно буд играть на фортепиана,и я вообразила себе как она будет играть на фортепиано,0.5,0.1851851851851851
5195,c13ae00fa318.wav,не надо его звить,просто не надо его злить,0.4,0.3333333333333333
5196,c1489e57146e.wav,истестно воду тоже встречается,и естественно в аду тоже встречаются,0.8333333333333334,0.2222222222222222
5197,c17653e8ff1d.wav,руками деланьем возвращенные в родные стены,с рукамиделанием возвращённым в родные стены,0.5,0.1363636363636363
5198,c182a7eebfc0.wav,из этих мучительных гродов не зная на природу будем жить в уникальных капсулах,из этих мучительных городов на природу будем жить в уникальных капсулах,0.2727272727272727,0.1267605633802817
5199,c1a5489b039f.wav,поэтому поэтому вашно отказан,поэтому важно отказаться,1.0,0.5416666666666666
5200,c1a6605826eb.wav,а вот физический мир кажется что они меняют не сильны,а вот физический мир кажется что они меняют несильно,0.2222222222222222,0.0384615384615384
5201,c1a9372a3ecb.wav,сами для себя,сами для себя,0.0,0.0
5202,c1b12c8ac0a0.wav,преследули примерно как во времена иный квизиции,преследовали примерно как во времена инквизиции,0.5,0.1276595744680851
5203,c1b41d35fffd.wav,там была одежда которона не ндо надеть бо,там была одежда которую на неё надо надеть,0.625,0.1904761904761904
5204,c1b6e8b195de.wav,по контрасту или по причине или вследствии процессов глобализации,по контрасту или по причине или вследствие процессов глобализации,0.1111111111111111,0.0153846153846153
5205,c1b77aa5493e.wav,а теперь внимание,а теперь внимание,0.0,0.0
5206,c1bd775c5e9a.wav,пробегитесь по телу мысленно,пробегитесь по телу мысленно,0.0,0.0
5207,c1cfb776c0d0.wav,а из горло саши  нашело героя,а из горла саши нашего героя,0.3333333333333333,0.1071428571428571
5208,c1d3a968d3d0.wav,что в какой-то момент мы с вами все приедем на конец,что в какой то момент мы с вами все переедем наконец,0.4545454545454545,0.0769230769230769
5209,c1df848f7931.wav,так вот если о правыйте предположени,так вот если правы те предположения,0.5,0.1142857142857142
5210,c203077c8eaa.wav,я их замечательно разделываю и раскладываю побаночкам,а я их замечательно разделываю и раскладываю по баночкам,0.3333333333333333,0.0535714285714285
5211,c2089bfc9357.wav,амбудь осторожны с этими стройтенгми,поэтому будьте осторожны с этими рейтингами,0.5,0.3255813953488372
5212,c20af473ebbd.wav,но и у нас в роси всю больше и боре,а значит и у нас в россии всё больше и больше,0.4545454545454545,0.2888888888888888
5213,c21e3104ac3f.wav,вы мечтатели и кажется мне кажется что ваши дети самые счастливые на свете,вы мечтатели и мне кажется что ваши дети самые счастливые на свете,0.0833333333333333,0.1212121212121212
5214,c2244c3a5875.wav,все что не переварилось попадает внижнее отделы где живут микробы,а всё что не переварилось попадает в нижний отдел где живут микробы,0.4166666666666667,0.1044776119402985
